{
  "documentKind": "graphtruth.author-call-result-schema-exploratory-learning-result/1",
  "identity": "author-call-result-schema-exploratory-learning-v1",
  "bindings": {
    "boundarySha256": "4fd2f38bb230436a7cedb2610eaedc3d0ccae036a8163ba91b732f17c6bd96a3",
    "executionPackManifestSha256": "e7a95f4002c9e24e421ab41074ec52362fd9a054cd958f13c294f5458de3341c",
    "readerSha256": "d183662c07501668517ac30440e9478f09fc1e9f6c752b02890e917e30fce06c",
    "resultSchemaSha256": "527ae1b36665c21c00325bed27606b3b3a813012019ca8f43e7db4f0cf6435dc",
    "toolingManifestSha256": "bf6e7f671c60fb3a3748ff5a03aeca93500cb40fe2664c388634287049290200",
    "qualificationResultSha256": "aa07980cd8b9a05d699f5a491733ea2dd2a710955d13a783249a4e9721979b94",
    "traceParserSha256": "28a821f843d71489974bfa65ed931de8a304eea3dff5ab570ea02f5a1d596025",
    "strictJsonParserSha256": "603553be7d0ca32cb11ccce7eadfb711277dc6ae9c55d2d68f08abafd9e5750b",
    "syntheticManifestSha256": "ba2b8e825f05179b66ce874fc03a7540b59c15e96495b95764189bec33da1bda",
    "qualificationOutputSchemaSha256": "fc53db78d5f4c04b0e0c5d94675771b4c2ddd22fd708c5a624952ee6a3edc23e",
    "processingAuthorizationRecord": "https://github.com/asukhodko/graphtruth/issues/24#issuecomment-5073995561"
  },
  "budgets": {
    "protectedInputFilesOpened": 1,
    "admittedInputBytes": 38920,
    "protectedFilePasses": 1,
    "readerRunsCommitted": 1,
    "currentSessionMessageExposures": 1,
    "currentSessionProcessingEpisodes": 1,
    "otherRawReaders": 0,
    "separatelyLaunchedModelSessions": 0,
    "retries": 0,
    "resumes": 0,
    "stderrReads": 0,
    "corpusReads": 0,
    "projectionReads": 0,
    "privateM1Reads": 0,
    "localReaderNetworkRequests": 0,
    "readerWallTimeLimitSeconds": 60,
    "readerMemoryLimitBytes": 134217728,
    "derivedStateLimitBytes": 131072,
    "publicRecordLimitBytes": 16384
  },
  "predicates": {
    "strictJson": {
      "state": "passed",
      "basis": "directly-observed"
    },
    "closedObjectShape": {
      "state": "passed",
      "basis": "directly-observed"
    },
    "payloadJsonString": {
      "state": "passed",
      "basis": "directly-observed"
    },
    "expectedPayloadBytes": {
      "state": "failed",
      "basis": "directly-observed"
    }
  },
  "firstFailure": {
    "code": "payload-json-byte-mismatch",
    "basis": "directly-observed"
  },
  "measurements": {
    "finalMessageBytes": {
      "value": 34724,
      "basis": "directly-observed"
    },
    "rootKeyCount": {
      "value": 1,
      "basis": "directly-observed"
    },
    "missingRootKeyCount": {
      "value": 0,
      "basis": "deterministically-derived"
    },
    "unexpectedRootKeyCount": {
      "value": 0,
      "basis": "deterministically-derived"
    },
    "payloadJsonBytes": {
      "value": 32768,
      "basis": "directly-observed"
    },
    "expectedObservedByteDelta": {
      "value": 0,
      "basis": "deterministically-derived"
    }
  },
  "routes": {
    "recommended": "reduced-echo-contract",
    "alternatives": [
      "prompt-schema-adjustment",
      "alternate-execution"
    ]
  },
  "attestations": {
    "boundaryRespected": true,
    "noRepair": true,
    "noRetry": true,
    "noResume": true,
    "noFallbackParsing": true,
    "noNormalization": true,
    "noExperimentalRun": true,
    "finalMessageTreatedAsUntrusted": true,
    "noMessageDigestPublished": true,
    "noProtectedPathPublished": true,
    "providerCopiesUnverified": true
  },
  "deletion": {
    "stdout": "pending",
    "stderr": "pending",
    "workRoot": "pending"
  }
}
